{
    "$schema": "http://json-schema.org/draft-03/schema",
    "type": "object",
    "properties": {
    	"timeline_url": {
    		"type": "string"
    	},
    	"user_url": {
    		"type": "string"
    	},
    	"current_user_public": {
    		"type": "string"
    	},
    	"current_user_url": {
    		"type": "string"
    	},
    	"current_user_actor_url": {
    		"type": "string"
    	},
    	"current_user_organization_url": {
    		"type": "string"
    	},
    	"_links": {
    		"properties": {
    			"timeline": {
    				"properties": {
    					"href": {
    						"type": "string"
    					},
    					"type": {
    						"type": "string"
    					}
    				},
    				"type": "object"
    			},
    			"user": {
    				"properties": {
    					"href": {
    						"type": "string"
    					},
    					"type": {
    						"type": "string"
    					}
    				},
    				"type": "object"
    			},
    			"current_user_public": {
    				"properties": {
    					"href": {
    						"type": "string"
    					},
    					"type": {
    						"type": "string"
    					}
    				},
    				"type": "object"
    			},
    			"current_user": {
    				"properties": {
    					"href": {
    						"type": "string"
    					},
    					"type": {
    						"type": "string"
    					}
    				},
    				"type": "object"
    			},
    			"current_user_actor": {
    				"properties": {
    					"href": {
    						"type": "string"
    					},
    					"type": {
    						"type": "string"
    					}
    				},
    				"type": "object"
    			},
    			"current_user_organization": {
    				"properties": {
    					"href": {
    						"type": "string"
    					},
    					"type": {
    						"type": "string"
    					}
    				},
    				"type": "object"
    			}
    		}
    	}
    }
}